[
  {
    "schema_version": "stage0.rev2",
    "check_id": "qa_file_integrity_checksum",
    "check_category": "file_integrity",
    "severity": "blocking",
    "workflow": "ecommerce_growth_pack",
    "asset_id": "asset_aurora_packshot_corrupt_png",
    "evidence": {
      "observed": {
        "mime_type": "image/png",
        "checksum_sha256": "mismatch",
        "decoder_status": "failed",
        "byte_size": 1842
      },
      "expected": {
        "mime_type": "image/png",
        "checksum_sha256": "matches_object_metadata",
        "decoder_status": "ok",
        "byte_size_min": 1024
      },
      "trace_id": "trace_fx_brand_product_preservation_integrity",
      "fixture_id": "fx_brand_product_preservation",
      "source_artifacts": [
        "fixtures/assets/aurora_bottle_packshot.png",
        "object_metadata.checksum"
      ]
    },
    "export_gate": {
      "blocks_final_export": true,
      "eligible_admin_override": false,
      "override_requires_audit": true
    },
    "auto_fix_available": false,
    "review_required": true,
    "user_visible_message": "One image file cannot be verified and must be regenerated before export.",
    "admin_reason": "Stage 0 Rev2 requires file integrity evidence before an asset can enter final export.",
    "provenance": {
      "blueprint_sections": [
        "15.1",
        "15.2"
      ],
      "created_by_lane": "lane2"
    }
  },
  {
    "schema_version": "stage0.rev2",
    "check_id": "qa_dimensions_platform_target",
    "check_category": "dimensions",
    "severity": "blocking",
    "workflow": "local_merchant_campaign_pack",
    "asset_id": "asset_north_pier_story_wrong_size",
    "evidence": {
      "observed": {
        "width_px": 1280,
        "height_px": 720,
        "export_target": "instagram_story"
      },
      "expected": {
        "width_px": 1080,
        "height_px": 1920,
        "export_target": "instagram_story"
      },
      "trace_id": "trace_fx_local_merchant_campaign_golden_dimensions",
      "fixture_id": "fx_local_merchant_campaign_golden",
      "source_artifacts": [
        "manifest.json",
        "candidate_asset.metadata"
      ]
    },
    "export_gate": {
      "blocks_final_export": true,
      "eligible_admin_override": true,
      "override_requires_audit": true
    },
    "auto_fix_available": true,
    "review_required": false,
    "user_visible_message": "One export size does not match the selected channel.",
    "admin_reason": "Channel-specific export dimensions must match the workflow acceptance target.",
    "provenance": {
      "blueprint_sections": [
        "6.1",
        "15.2"
      ],
      "created_by_lane": "lane2"
    }
  },
  {
    "schema_version": "stage0.rev2",
    "check_id": "qa_aspect_ratio_channel",
    "check_category": "aspect_ratio",
    "severity": "warning",
    "workflow": "ecommerce_growth_pack",
    "asset_id": "asset_aurora_marketplace_banner",
    "evidence": {
      "observed": {
        "aspect_ratio": "16:9",
        "export_target": "marketplace_square"
      },
      "expected": {
        "aspect_ratio": "1:1",
        "export_target": "marketplace_square"
      },
      "trace_id": "trace_fx_ecommerce_growth_golden_aspect",
      "fixture_id": "fx_ecommerce_growth_golden",
      "source_artifacts": [
        "workflow_acceptance.ecommerce_growth_pack.json",
        "manifest.json"
      ]
    },
    "export_gate": {
      "blocks_final_export": false,
      "eligible_admin_override": false,
      "override_requires_audit": true
    },
    "auto_fix_available": true,
    "review_required": false,
    "user_visible_message": "One asset may need resizing for the selected placement.",
    "admin_reason": "Aspect ratio mismatch is tracked before packaging so the export builder can produce the required derivative.",
    "provenance": {
      "blueprint_sections": [
        "6.2",
        "15.2"
      ],
      "created_by_lane": "lane2"
    }
  },
  {
    "schema_version": "stage0.rev2",
    "check_id": "qa_platform_safe_area",
    "check_category": "safe_area",
    "severity": "warning",
    "workflow": "local_merchant_campaign_pack",
    "asset_id": "asset_north_pier_story_cta",
    "evidence": {
      "observed": {
        "cta_bottom_margin_px": 42,
        "safe_area_bottom_min_px": 180,
        "overlaps_platform_ui": true
      },
      "expected": {
        "cta_bottom_margin_px_min": 180,
        "overlaps_platform_ui": false
      },
      "trace_id": "trace_fx_local_merchant_campaign_golden_safe_area",
      "fixture_id": "fx_local_merchant_campaign_golden",
      "source_artifacts": [
        "candidate_asset.layout.json",
        "workflow_acceptance.local_merchant_campaign_pack.json"
      ]
    },
    "export_gate": {
      "blocks_final_export": false,
      "eligible_admin_override": false,
      "override_requires_audit": true
    },
    "auto_fix_available": true,
    "review_required": false,
    "user_visible_message": "A call-to-action is too close to the platform controls.",
    "admin_reason": "Platform safe-area checks prevent UI chrome from covering required campaign information.",
    "provenance": {
      "blueprint_sections": [
        "6.4",
        "15.2"
      ],
      "created_by_lane": "lane2"
    }
  },
  {
    "schema_version": "stage0.rev2",
    "check_id": "qa_blank_output",
    "check_category": "blank_output",
    "severity": "blocking",
    "workflow": "character_ip_concept_pack",
    "asset_id": "candidate_nova_spark_blank_sheet",
    "evidence": {
      "observed": {
        "near_blank": true,
        "non_background_pixel_ratio": 0.01,
        "detected_subjects": 0
      },
      "expected": {
        "near_blank": false,
        "non_background_pixel_ratio_min": 0.12,
        "detected_subjects_min": 1
      },
      "trace_id": "trace_fx_character_ip_concept_golden_blank",
      "fixture_id": "fx_character_ip_concept_golden",
      "source_artifacts": [
        "candidate_asset.preview.png",
        "qa_report.json"
      ]
    },
    "export_gate": {
      "blocks_final_export": true,
      "eligible_admin_override": false,
      "override_requires_audit": true
    },
    "auto_fix_available": true,
    "review_required": false,
    "user_visible_message": "One generated option appears blank and must be regenerated.",
    "admin_reason": "Near-blank generated assets cannot satisfy the Rev2 workflow output contract.",
    "provenance": {
      "blueprint_sections": [
        "15.1",
        "15.2"
      ],
      "created_by_lane": "lane2"
    }
  },
  {
    "schema_version": "stage0.rev2",
    "check_id": "qa_duplicate_candidate_similarity",
    "check_category": "duplicate_similarity",
    "severity": "blocking",
    "workflow": "local_merchant_campaign_pack",
    "asset_id": "candidate_north_pier_generic_cards",
    "evidence": {
      "observed": {
        "duplicate_similarity": 0.96,
        "candidate_pair": [
          "candidate_a",
          "candidate_b"
        ]
      },
      "expected": {
        "duplicate_similarity_below": 0.9,
        "candidate_pair_must_differ": true
      },
      "trace_id": "trace_fx_negative_generic_rendering_similarity",
      "fixture_id": "fx_negative_generic_rendering",
      "source_artifacts": [
        "local_merchant_candidate_set.json",
        "qa_report.json"
      ]
    },
    "export_gate": {
      "blocks_final_export": true,
      "eligible_admin_override": true,
      "override_requires_audit": true
    },
    "auto_fix_available": false,
    "review_required": true,
    "user_visible_message": "Two generated options are too similar to count as distinct choices.",
    "admin_reason": "Duplicate candidate similarity above the threshold violates the four-option strategy requirement.",
    "provenance": {
      "blueprint_sections": [
        "6.1",
        "15.2"
      ],
      "created_by_lane": "lane2"
    }
  },
  {
    "schema_version": "stage0.rev2",
    "check_id": "qa_four_option_distinctness",
    "check_category": "four_option_distinctness",
    "severity": "blocking",
    "workflow": "local_merchant_campaign_pack",
    "asset_id": "candidate_north_pier_generic_cards",
    "evidence": {
      "observed": {
        "strategic_options": 1,
        "taxonomy_coverage": [
          "limited_time_offer"
        ]
      },
      "expected": {
        "strategic_options": 4,
        "taxonomy_coverage": [
          "grand_opening",
          "limited_time_offer",
          "community_event",
          "loyalty_push"
        ]
      },
      "trace_id": "trace_fx_negative_generic_rendering_distinctness",
      "fixture_id": "fx_negative_generic_rendering",
      "source_artifacts": [
        "workflow_acceptance.local_merchant_campaign_pack.json",
        "local_merchant_candidate_set.json"
      ]
    },
    "export_gate": {
      "blocks_final_export": true,
      "eligible_admin_override": true,
      "override_requires_audit": true
    },
    "auto_fix_available": false,
    "review_required": true,
    "user_visible_message": "The four options do not cover four different strategies.",
    "admin_reason": "Rev2 forbids marking generic four-card rendering as workflow completion.",
    "provenance": {
      "blueprint_sections": [
        "6.1",
        "15.2"
      ],
      "created_by_lane": "lane2"
    }
  },
  {
    "schema_version": "stage0.rev2",
    "check_id": "qa_ecommerce_duplicate_candidate_similarity",
    "check_category": "duplicate_similarity",
    "severity": "blocking",
    "workflow": "ecommerce_growth_pack",
    "asset_id": "candidate_aurora_me_too_social_ads",
    "evidence": {
      "observed": {
        "duplicate_similarity": 0.94,
        "candidate_pair": [
          "conversion_offer",
          "social_proof"
        ]
      },
      "expected": {
        "duplicate_similarity_below": 0.9,
        "candidate_pair_must_differ": true
      },
      "trace_id": "trace_fx_brand_product_preservation_duplicate",